{
  "schema_version": "0.1.0",
  "id": "aim-bot.runtime.capture-shape.code-default",
  "topic": "runtime.capture.input-shape",
  "kind": "derived_fact",
  "status": "observed",
  "scope": {
    "repository": "aim_bot_study",
    "branch": "dev",
    "profile": "no-config-fallback"
  },
  "value": {
    "width": 480,
    "height": 416
  },
  "authority": {
    "type": "code-default",
    "subject": "Implementation default when no external configuration is loaded"
  },
  "sources": [
    {
      "path": "native/runtime_app/main.cpp",
      "commit": "fixture-commit-to-be-pinned"
    }
  ],
  "impacted_by": [
    {
      "kind": "path",
      "value": "native/runtime_app/main.cpp"
    }
  ],
  "verification": {
    "method": "static-scan",
    "verified_at": "2026-09-02T15:55:46+08:00",
    "verified_commit": "fixture-commit-to-be-pinned"
  },
  "renders_to": [
    "docs/cognition/START_HERE.md"
  ]
}
