{
  "schema_version": "0.1.0",
  "id": "aim-bot.runtime.capture-shape.recommended-native",
  "topic": "runtime.capture.input-shape",
  "kind": "declared_intent",
  "status": "inferred",
  "scope": {
    "repository": "aim_bot_study",
    "branch": "dev",
    "profile": "recommended-native-gamepad"
  },
  "value": {
    "width": 640,
    "height": 512
  },
  "authority": {
    "type": "recommended-config",
    "subject": "Repository example configuration appears to recommend this capture profile"
  },
  "sources": [
    {
      "path": "config.native.example.toml",
      "commit": "fixture-commit-to-be-pinned"
    }
  ],
  "confidence": 0.7,
  "impacted_by": [
    {
      "kind": "path",
      "value": "config.native.example.toml"
    }
  ],
  "notes": "This remains inferred until the fixture is pinned and a maintainer confirms the repository recommendation."
}
